Value,Disaggregation combinations using this value,Number of indicators
African Development Bank Group Annual Report 2019,36,2
"ASPIRE: The Atlas of Social Protection - Indicators of Resilience and Equity, The World Bank. Data are based on national representative household surveys. (datatopics.worldbank.org/aspire/)",5,1
CHM / WESR ,2,1
Compiled by UNECA African Centre for Statistics and UN Women,2,1
DAD-IS 21.11.2022 http://www.fao.org/dad-is/,2,1
DAD-IS 28.11.2022 http://www.fao.org/dad-is/,2,1
"Data based on the World Telecommunication/ICT Indicators Database, 2021, International Telecommunication Union (ITU)",4,1
Data gathered as a result of a survey,2,1
Data gathered from the latest version of NBSAP,3,1
"Data submitted by FSC and PEFC secretariats (certifying bodies) to FAO, Global Forest Resources Assessment",2,1
Education Abstract 2017 (http://www.education.go.ug/wp-content/uploads/2019/08/Abstract-2017.pdf); Data extracted on 01 April 2022.,21,1
Environment Live,4,1
Estimated using the Adjusted Bayesian Completion Rates estimation model using household survey data [https://osf.io/preprints/socarxiv/at368/]; Data extracted on 01 April 2022.,36,1
FAO calculation based on WB national account data,2,1
FAO estimate based on FAOSTAT data from 2019,3,1
"FAO, Global Forest Resources Assessment and FAOSTAT",1,1
"FAO, Global Forest Resources Assessment",3,2
FAO-WIEWS (http://www.fao.org/wiews),5,1
Food and Agriculture Organization of the United Nations (FAO),48,1
Food Price Monitoring and Analysis (FPMA) online database: https://fpma.apps.fao.org/giews/food-prices/tool/public/#/dataset/domestic.,3,1
Global Surface Water Explorer extraction for UN Environment Programme,20,1
https://absch.cbd.int/countries,1,1
"https://www.cbd.int/abs/nagoya-protocol/signatories/default.shtml, Access and Benefit-sharing Clearing-house https://absch.cbd.int/, http://www.fao.org/plant-treaty/countries/membership/en/,  The Online Reporting System on Compliance of the International ",1,1
ICAO,3,1
IFC 2021 Annual Report Volume 2,40,2
IHR National Self-Assessment and reports received and available at WHO e-SPAR database (https://extranet.who.int/e-spar/ )	 WHO Global Health Observatory (https://www.who.int/data/gho/data/themes/international-health-regulations-(2005)-monitoring-framework,16,1
IHR National Self-Assessment and reports received and registered at WHO e-SPAR database (https://extranet.who.int/e-spar/ ).,42,1
IMF Annual Report 2021,40,2
"Inter-Parliamentary Union (IPU), Parline Database",7,1
"International Bank for Reconstruction and Development Management’s Discussion & Analysis and Financial Statements June 30, 2021",40,2
"International Monetary Fund, Balance of Payments Statistics Yearbook and data files, and World Bank and OECD GDP estimates.",1,1
"International Monetary Fund, Balance of Payments Statistics Yearbook and data files.",1,1
"International Monetary Fund, Financial Soundness Indicators.",1,1
"International Monetary Fund, Government Finance Statistics Yearbook and data files, and World Bank and OECD GDP estimates.",2,1
"International Monetary Fund, International Financial Statistics and Balance of Payments databases, World Bank, International Debt Statistics, and World Bank and OECD GDP estimates.",2,1
"International Monetary Fund, International Financial Statistics and data files.",4,1
"International Monetary Fund, International Financial Statistics, supplemented by World Bank staff estimates.",1,1
ITPGRFA Secretariat ,3,1
NA,7,2
National Criminal Justice Data as Collected through the United Nations Surveys on Crime Trends and the Operations of Criminal Justice Systems (UN-CTS),4,1
National Entity,24,1
National Learning Assessment (NLA): National Assessment of Progress in Education (NAPE); Grade 3; Minimum proficiency level: Advance Data extracted on 01 April 2022.,4,1
National Learning Assessment (NLA): National Assessment of Progress in Education (NAPE); Grade 3; Minimum proficiency level: Advance,12,1
National Learning Assessment (NLA): National Assessment of Progress in Education (NAPE); Grade 6; Minimum proficiency level: Adequate level Data extracted on 01 April 2022.,2,1
National Learning Assessment (NLA): National Assessment of Progress in Education (NAPE); Grade 6; Minimum proficiency level: Adequate level,12,1
National Learning Assessment (NLA): National Assessment of Progress in Education (NAPE); Grade 9; Minimum proficiency level: Adequate level Data extracted on 01 April 2022.,2,1
National Learning Assessment (NLA): National Assessment of Progress in Education (NAPE); Grade 9; Minimum proficiency level: Adequate level,6,1
"Poverty and Inequality Portal, World Bank",10,1
Ramsar National Report COP14,1,1
Report of the Economic and Social Council on its 2017 Session (A/72/3),12,2
Report of the Security Council (A/65/2),4,2
Source: ILO estimates based on country data compled through the ILO Social Security Inquiry (SSI),8,1
"Source = ILO modelled estimates, November 2021, available in ILOSTAT (https://ilostat.ilo.org/). For the specific sources by country and the estimation methodology refer to ILOSTAT directly.",18,1
"Source: Joint Child Malnutrition Estimates (2021 Edition), United Nations Children's Fund (UNICEF), World Health Organisation (WHO) and the World Bank Group.",41,1
the International Transport Forum at the OECD (ITF-OECD),5,1
Uganda 2018-2019 Malaria Indicators Survey,6,1
Uganda 2019 PMA2020 Round 6 Follow-up,11,1
Uganda Communications Commission,14,1
"Uganda Demographic and Health Survey 2016. Kampala, Uganda and Rockville, Maryland, USA: UBOS and ICF. 2018",14,1
Uganda DHS 2016. The survey collected data on school attendance for age 5-24 and educatiol attainment for age 5 and above. Under Coverage (Students or individuals): Value based on 25-49 unweighted observations in sample.; Data extracted on 01 April 2022.,75,1
Uganda DHS 2016. The survey collected data on school attendance for age 5-24 and educatiol attainment for age 5 and above. Under Coverage (Students or individuals): Value suppressed (less than 25 unweighted observations in sample).; Data extracted on 01 April 2022.,15,1
Uganda DHS 2016. The survey collected data on school attendance for age 5-24 and educatiol attainment for age 5 and above.; Data extracted on 01 April 2022.,339,1
Uganda DHS 2016. The survey collected data on school attendance for age 5-24 and educational attainment for age 5 and above. Under Coverage (Students or individuals): Value based on 25-49 unweighted observations in sample.; Data extracted on 01 April 2022.,42,1
Uganda DHS 2016. The survey collected data on school attendance for age 5-24 and educational attainment for age 5 and above. Under Coverage (Students or individuals): Value suppressed (less than 25 unweighted observations in sample).; Data extracted on 01 April 2022.,9,1
Uganda DHS 2016. The survey collected data on school attendance for age 5-24 and educational attainment for age 5 and above.; Data extracted on 01 April 2022.,447,1
UN General Assembly website http://www.un.org/en/member-states/index.html,4,2
UNESCO Institute for Statistics.  Data extracted on 01 April 2022.,24,2
UNODC Research,8,1
UNSD/UNEP Questionnaire on Environment Statistics,2,1
"World Bank, International Debt Statistics.",1,1
"World Bank national accounts data, and OECD National Accounts data files.",6,1
World Environment Situation Room,1,1
"World Trade Organization, and World Bank GDP estimates.",1,1
WTO Annual Report 2021,28,2
